{
  "schema_version": 1,
  "id": "ai",
  "profile_class": "technical",
  "paths": {
    "workspace": "editions/ai",
    "editorial_profile": "editions/ai/edition.json",
    "sources": "editions/ai/sources/primary-sources.json",
    "content_root": "content/ai",
    "run_root": "var/runs/ai",
    "decision_root": "decisions/ai"
  },
  "schedule": {
    "enabled": true,
    "managed_by": "codex-automation",
    "timezone": "Asia/Seoul",
    "cadence": "daily at 08:00; maximum one published article per Seoul date"
  },
  "release": {
    "mode": "automatic",
    "requires_human_approval": false,
    "git_write": true,
    "deploy": true
  },
  "site": {
    "route_prefix": "/ai",
    "include_in_legacy_home": false
  },
  "forbidden_fallbacks": [
    "newsroom/charter.md",
    "newsroom/personas",
    "newsroom/sources.md",
    "editions/eda"
  ]
}
